{
  "doc_type": "jurisprudence",
  "document_kind": "tesis",
  "country": "mx",
  "jurisdiction": "federal",
  "court_system": "poder_judicial_federacion",
  "source_system": "scjn_bicentenario_repository",
  "doc_id": "mx-sjf-tesis-2031967",
  "registry_id": "2031967",
  "canonical_url": null,
  "source_url": "https://bicentenario.scjn.gob.mx/repositorio-scjn/api/v1/tesis/2031967",
  "retrieved_at": "2026-03-30T01:02:45.484067Z",
  "title": "INTERESES MORATORIOS. LA SUSPENSIÓN DE LAS ACTIVIDADES JURISDICCIONALES Y DE LOS PLAZOS PROCESALES DECRETADA CON MOTIVO DE LA PANDEMIA ORIGINADA POR EL VIRUS SARS-CoV-2, NO IMPLICA QUE DEJEN DE GENERARSE.",
  "rubro": "INTERESES MORATORIOS. LA SUSPENSIÓN DE LAS ACTIVIDADES JURISDICCIONALES Y DE LOS PLAZOS PROCESALES DECRETADA CON MOTIVO DE LA PANDEMIA ORIGINADA POR EL VIRUS SARS-CoV-2, NO IMPLICA QUE DEJEN DE GENERARSE.",
  "subtitle": null,
  "type": "Jurisprudencia",
  "epoch": "Duodécima Época",
  "instance": "Suprema Corte de Justicia de la Nación",
  "organ": "Pleno",
  "matter": [
    "Civil"
  ],
  "case_type": null,
  "case_numbers": [],
  "publication_date": null,
  "binding_note_date": null,
  "mandatory_effect": null,
  "citation_label": "P./J. 42/2026 (12a.) | registro digital 2031967",
  "text": "Hechos: En un juicio ordinario civil federal se condenó a la parte demandada al pago del monto adeudado con motivo del incumplimiento de un contrato de prestación de servicios de seguridad y vigilancia, así como los intereses moratorios correspondientes. En la etapa de ejecución, la parte actora promovió incidente de liquidación de intereses. La parte obligada alegó que durante el periodo en que se suspendieron las actividades jurisdiccionales y los plazos procesales a causa de la contingencia sanitaria provocada por el virus SARS-CoV-2, no debieron computarse intereses moratorios, a fin de preservar la igualdad procesal y el debido proceso. Criterio jurídico: La suspensión de las actividades jurisdiccionales y de los plazos procesales decretada con motivo de la contingencia sanitaria provocada por el virus SARS-CoV-2, no implica que los intereses moratorios derivados del incumplimiento de obligaciones contractuales dejen de generarse. Justificación: Los intereses moratorios constituyen una consecuencia jurídica del incumplimiento del deudor, de naturaleza sustantiva, cuya generación no depende del curso de los términos procesales ni de la actividad de los órganos jurisdiccionales, sino exclusivamente del retardo en el cumplimiento de la obligación principal. En consecuencia, la suspensión de plazos procesales decretada por causas extraordinarias, como una contingencia sanitaria, no exime al deudor del pago de los intereses moratorios, los cuales únicamente se interrumpen con el pago de las obligaciones pactadas. PLENO.",
  "text_normalized": "hechos: en un juicio ordinario civil federal se condenó a la parte demandada al pago del monto adeudado con motivo del incumplimiento de un contrato de prestación de servicios de seguridad y vigilancia, así como los intereses moratorios correspondientes. en la etapa de ejecución, la parte actora promovió incidente de liquidación de intereses. la parte obligada alegó que durante el periodo en que se suspendieron las actividades jurisdiccionales y los plazos procesales a causa de la contingencia sanitaria provocada por el virus sars-cov-2, no debieron computarse intereses moratorios, a fin de preservar la igualdad procesal y el debido proceso. criterio jurídico: la suspensión de las actividades jurisdiccionales y de los plazos procesales decretada con motivo de la contingencia sanitaria provocada por el virus sars-cov-2, no implica que los intereses moratorios derivados del incumplimiento de obligaciones contractuales dejen de generarse. justificación: los intereses moratorios constituyen una consecuencia jurídica del incumplimiento del deudor, de naturaleza sustantiva, cuya generación no depende del curso de los términos procesales ni de la actividad de los órganos jurisdiccionales, sino exclusivamente del retardo en el cumplimiento de la obligación principal. en consecuencia, la suspensión de plazos procesales decretada por causas extraordinarias, como una contingencia sanitaria, no exime al deudor del pago de los intereses moratorios, los cuales únicamente se interrumpen con el pago de las obligaciones pactadas. pleno.",
  "source_payload_path": "raw/scjn/payloads/tesis/2031967.json",
  "source_pdf_url": null,
  "source_pdf_path": null,
  "source_certificate_sha256": null,
  "parser_version": "scjn-tesis-normalizer-v1",
  "last_seen_at": null,
  "related_documents": [],
  "interpreted_norms": [],
  "status": "vigente_en_fuente",
  "text_checksum_sha256": "17fd2816746bc3c0403b42817f0062452babb8f3afd4e6493b70fc95963ea86f",
  "metadata_checksum_sha256": "e8ce98bdb8ba2480cc3b087fd74c3969d0f6760e30a56760e77e2ef76c866a00"
}
