{
  "doc_type": "jurisprudence",
  "document_kind": "tesis",
  "country": "mx",
  "jurisdiction": "federal",
  "court_system": "poder_judicial_federacion",
  "source_system": "scjn_bicentenario_repository",
  "doc_id": "mx-sjf-tesis-2031977",
  "registry_id": "2031977",
  "canonical_url": null,
  "source_url": "https://bicentenario.scjn.gob.mx/repositorio-scjn/api/v1/tesis/2031977",
  "retrieved_at": "2026-03-30T00:55:46.397584Z",
  "title": "PLAZO PARA PROMOVER AMPARO INDIRECTO CONTRA LA MULTA DERIVADA DE UNA INFRACCIÓN DE TRÁNSITO. FORMA DE COMPUTARLO CUANDO LA PERSONA PROPIETARIA DEL VEHÍCULO RECLAMA LA MULTA IMPUESTA A QUIEN LO CONDUCÍA.",
  "rubro": "PLAZO PARA PROMOVER AMPARO INDIRECTO CONTRA LA MULTA DERIVADA DE UNA INFRACCIÓN DE TRÁNSITO. FORMA DE COMPUTARLO CUANDO LA PERSONA PROPIETARIA DEL VEHÍCULO RECLAMA LA MULTA IMPUESTA A QUIEN LO CONDUCÍA.",
  "subtitle": null,
  "type": "Jurisprudencia",
  "epoch": "Duodécima Época",
  "instance": "Suprema Corte de Justicia de la Nación",
  "organ": "Pleno",
  "matter": [
    "Común"
  ],
  "case_type": null,
  "case_numbers": [],
  "publication_date": null,
  "binding_note_date": null,
  "mandatory_effect": null,
  "citation_label": "P./J. 37/2026 (12a.) | registro digital 2031977",
  "text": "Hechos: Los Tribunales Colegiados de Circuito contendientes sustentaron criterios contradictorios al analizar si para efectos del cómputo del plazo para promover amparo en el que la persona propietaria de un vehículo reclama una multa derivada de una infracción de tránsito impuesta a quien lo conducía, sin la presencia de aquélla, se debe atender a la fecha en que la boleta o cédula de notificación de la infracción fue entregada a la conductora, o bien, a la fecha en que la propietaria manifestó haber tenido conocimiento de ese acto. Criterio jurídico: Para el cómputo del plazo para promover amparo indirecto contra la multa derivada de una infracción de tránsito impuesta a quien conducía el vehículo sin la presencia de la propietaria, debe considerarse la fecha en que ésta fue notificada directamente del acto reclamado –si la normativa aplicable lo prevé–, o aquella en que tuvo conocimiento directo, exacto y completo del acto, o se ostentó sabedora de éste, y no la fecha en que la boleta o cédula de infracción se entregó a la conductora. Justificación: La Suprema Corte de Justicia de la Nación ha considerado que el conocimiento del acto reclamado por la persona quejosa debe estar probado de modo directo y no inferirse con base en presunciones. Además, que debe quedar probado de forma plena el momento en que el particular tuvo conocimiento directo, exacto y completo del acto reclamado. Por tanto, no puede afirmarse que la persona propietaria del vehículo fue notificada o tuvo conocimiento de la multa derivada de una infracción de tránsito, por el hecho de que la boleta o cédula de notificación relativa se haya entregado a quien lo conducía, pues ello supondría presumir que la persona conductora necesariamente enterará a la propietaria del acto de autoridad, lo que no es admisible en el juicio de amparo. Así, la responsabilidad solidaria prevista en ciertos ordenamientos entre la propietaria del vehículo y quien lo conduce, respecto de las infracciones de tránsito que éste cometa, no puede tener el alcance de anular el derecho de la quejosa a promover el amparo dentro del plazo legal, el cual debe computarse desde su notificación o desde que tuvo conocimiento del acto reclamado. PLENO.",
  "text_normalized": "hechos: los tribunales colegiados de circuito contendientes sustentaron criterios contradictorios al analizar si para efectos del cómputo del plazo para promover amparo en el que la persona propietaria de un vehículo reclama una multa derivada de una infracción de tránsito impuesta a quien lo conducía, sin la presencia de aquélla, se debe atender a la fecha en que la boleta o cédula de notificación de la infracción fue entregada a la conductora, o bien, a la fecha en que la propietaria manifestó haber tenido conocimiento de ese acto. criterio jurídico: para el cómputo del plazo para promover amparo indirecto contra la multa derivada de una infracción de tránsito impuesta a quien conducía el vehículo sin la presencia de la propietaria, debe considerarse la fecha en que ésta fue notificada directamente del acto reclamado –si la normativa aplicable lo prevé–, o aquella en que tuvo conocimiento directo, exacto y completo del acto, o se ostentó sabedora de éste, y no la fecha en que la boleta o cédula de infracción se entregó a la conductora. justificación: la suprema corte de justicia de la nación ha considerado que el conocimiento del acto reclamado por la persona quejosa debe estar probado de modo directo y no inferirse con base en presunciones. además, que debe quedar probado de forma plena el momento en que el particular tuvo conocimiento directo, exacto y completo del acto reclamado. por tanto, no puede afirmarse que la persona propietaria del vehículo fue notificada o tuvo conocimiento de la multa derivada de una infracción de tránsito, por el hecho de que la boleta o cédula de notificación relativa se haya entregado a quien lo conducía, pues ello supondría presumir que la persona conductora necesariamente enterará a la propietaria del acto de autoridad, lo que no es admisible en el juicio de amparo. así, la responsabilidad solidaria prevista en ciertos ordenamientos entre la propietaria del vehículo y quien lo conduce, respecto de las infracciones de tránsito que éste cometa, no puede tener el alcance de anular el derecho de la quejosa a promover el amparo dentro del plazo legal, el cual debe computarse desde su notificación o desde que tuvo conocimiento del acto reclamado. pleno.",
  "source_payload_path": "raw/scjn/payloads/tesis/2031977.json",
  "source_pdf_url": null,
  "source_pdf_path": null,
  "source_certificate_sha256": null,
  "parser_version": "scjn-tesis-normalizer-v1",
  "last_seen_at": null,
  "related_documents": [],
  "interpreted_norms": [],
  "status": "vigente_en_fuente",
  "text_checksum_sha256": "85b176322c5f06fb529ca0dc89e288fd4c3f74accc9d030950a7701f9a3ef0aa",
  "metadata_checksum_sha256": "757aae433de41d6133e567b3524449abfd932fc34907cf5f69214731e365870a"
}
