{
  "doc_type": "jurisprudence",
  "document_kind": "tesis",
  "country": "mx",
  "jurisdiction": "federal",
  "court_system": "poder_judicial_federacion",
  "source_system": "scjn_bicentenario_repository",
  "doc_id": "mx-sjf-tesis-2031983",
  "registry_id": "2031983",
  "canonical_url": null,
  "source_url": "https://bicentenario.scjn.gob.mx/repositorio-scjn/api/v1/tesis/2031983",
  "retrieved_at": "2026-03-30T00:51:00.893045Z",
  "title": "REPOSICIÓN DEL PROCEDIMIENTO DEL JUICIO PENAL AL DECLARARSE LA NULIDAD DE LA SENTENCIA CONDENATORIA EMITIDA POR EL TRIBUNAL DE ENJUICIAMIENTO. CONSTITUYE UN ACTO DE IMPOSIBLE REPARACIÓN PARA LA QUEJOSA VÍCTIMA DIRECTA DE UN DELITO SEXUAL, POR LA AFECTACIÓN MATERIAL A SU DERECHO A LA NO REVICTIMIZACIÓN.",
  "rubro": "REPOSICIÓN DEL PROCEDIMIENTO DEL JUICIO PENAL AL DECLARARSE LA NULIDAD DE LA SENTENCIA CONDENATORIA EMITIDA POR EL TRIBUNAL DE ENJUICIAMIENTO. CONSTITUYE UN ACTO DE IMPOSIBLE REPARACIÓN PARA LA QUEJOSA VÍCTIMA DIRECTA DE UN DELITO SEXUAL, POR LA AFECTACIÓN MATERIAL A SU DERECHO A LA NO REVICTIMIZACIÓN.",
  "subtitle": null,
  "type": "Aislada",
  "epoch": "Duodécima Época",
  "instance": "Tribunales Colegiados de Circuito",
  "organ": "SEGUNDO TRIBUNAL COLEGIADO EN MATERIAS PENAL Y DE TRABAJO DEL DECIMO TERCER CIRCUITO.",
  "matter": [
    "Penal",
    "Constitucional"
  ],
  "case_type": null,
  "case_numbers": [],
  "publication_date": null,
  "binding_note_date": null,
  "mandatory_effect": null,
  "citation_label": "XIII.2o.P.T.1 P (12a.) | registro digital 2031983",
  "text": "Hechos: La víctima directa de un delito sexual promovió amparo indirecto contra la resolución de la Sala Penal que declaró la nulidad de la sentencia condenatoria y ordenó la reposición del juicio oral. El Juzgado de Distrito sobreseyó el juicio al considerar que el acto reclamado no es de imposible reparación, al actualizarse la causal de improcedencia prevista en el artículo 61, fracción XXIII, en relación con el diverso 107, fracción V, de la Ley de Amparo. Criterio jurídico: La resolución que declara la nulidad de la sentencia condenatoria y ordena la reposición del procedimiento penal constituye un acto de imposible reparación cuando se trata de una víctima directa de un delito sexual, al implicar una afectación material a derechos sustantivos tutelados por la Constitución Política de los Estados Unidos Mexicanos, particularmente al derecho a la no revictimización, previsto en su artículo 20, apartado C, fracción V, por lo que no se actualiza la causal de improcedencia prevista en el artículo 61, fracción XXIII, en relación con la fracción V del artículo 107, ambos de la Ley de Amparo. Justificación: La decisión del Tribunal de Alzada que revoca una sentencia condenatoria dictada en un proceso penal por un delito de naturaleza sexual y ordena la reposición del procedimiento, si bien no contiene un pronunciamiento sobre el fondo del asunto, sí pospone su definición y constituye una medida excepcional que debe encontrarse plenamente justificada y resultar estrictamente necesaria, pues incide de manera directa en los derechos de la víctima. En efecto, la reposición del procedimiento penal implica que la víctima directa deba comparecer nuevamente para el desahogo de actuaciones procesales, lo que puede generar una afectación material a su derecho a la no revictimización, reconocido en los artículos 20, apartado C, fracción V, de la Constitución Federal, 5 de la Ley General de Víctimas, y 8 y 25 de la Convención Americana sobre Derechos Humanos. Por tanto, tratándose de delitos sexuales, la reposición del procedimiento no puede considerarse un acto meramente formal o de trámite, sino uno que impacta de manera sustantiva en la esfera jurídica de la víctima. En ese contexto, no resulta válido sobreseer el juicio de amparo bajo el argumento de que el acto reclamado no es de imposible reparación, sino que debe analizarse el fondo del asunto, ponderando el derecho de defensa adecuada del imputado frente al derecho fundamental de la víctima a no ser revictimizada, a fin de armonizar los valores en tensión y preservar el equilibrio procesal. SEGUNDO TRIBUNAL COLEGIADO EN MATERIAS PENAL Y DE TRABAJO DEL DÉCIMO TERCER CIRCUITO.",
  "text_normalized": "hechos: la víctima directa de un delito sexual promovió amparo indirecto contra la resolución de la sala penal que declaró la nulidad de la sentencia condenatoria y ordenó la reposición del juicio oral. el juzgado de distrito sobreseyó el juicio al considerar que el acto reclamado no es de imposible reparación, al actualizarse la causal de improcedencia prevista en el artículo 61, fracción xxiii, en relación con el diverso 107, fracción v, de la ley de amparo. criterio jurídico: la resolución que declara la nulidad de la sentencia condenatoria y ordena la reposición del procedimiento penal constituye un acto de imposible reparación cuando se trata de una víctima directa de un delito sexual, al implicar una afectación material a derechos sustantivos tutelados por la constitución política de los estados unidos mexicanos, particularmente al derecho a la no revictimización, previsto en su artículo 20, apartado c, fracción v, por lo que no se actualiza la causal de improcedencia prevista en el artículo 61, fracción xxiii, en relación con la fracción v del artículo 107, ambos de la ley de amparo. justificación: la decisión del tribunal de alzada que revoca una sentencia condenatoria dictada en un proceso penal por un delito de naturaleza sexual y ordena la reposición del procedimiento, si bien no contiene un pronunciamiento sobre el fondo del asunto, sí pospone su definición y constituye una medida excepcional que debe encontrarse plenamente justificada y resultar estrictamente necesaria, pues incide de manera directa en los derechos de la víctima. en efecto, la reposición del procedimiento penal implica que la víctima directa deba comparecer nuevamente para el desahogo de actuaciones procesales, lo que puede generar una afectación material a su derecho a la no revictimización, reconocido en los artículos 20, apartado c, fracción v, de la constitución federal, 5 de la ley general de víctimas, y 8 y 25 de la convención americana sobre derechos humanos. por tanto, tratándose de delitos sexuales, la reposición del procedimiento no puede considerarse un acto meramente formal o de trámite, sino uno que impacta de manera sustantiva en la esfera jurídica de la víctima. en ese contexto, no resulta válido sobreseer el juicio de amparo bajo el argumento de que el acto reclamado no es de imposible reparación, sino que debe analizarse el fondo del asunto, ponderando el derecho de defensa adecuada del imputado frente al derecho fundamental de la víctima a no ser revictimizada, a fin de armonizar los valores en tensión y preservar el equilibrio procesal. segundo tribunal colegiado en materias penal y de trabajo del décimo tercer circuito.",
  "source_payload_path": "raw/scjn/payloads/tesis/2031983.json",
  "source_pdf_url": null,
  "source_pdf_path": null,
  "source_certificate_sha256": null,
  "parser_version": "scjn-tesis-normalizer-v1",
  "last_seen_at": null,
  "related_documents": [],
  "interpreted_norms": [],
  "status": "vigente_en_fuente",
  "text_checksum_sha256": "de4faf794096deb0adc1a6af8e4f24a34b998d24f9af70042f51f64d70dac5f2",
  "metadata_checksum_sha256": "77362b184a7655b7f5db557a885232d98c30a5b1d0f531e4b8ad2edb09acfcef"
}
