{
  "doc_type": "jurisprudence",
  "document_kind": "tesis",
  "country": "mx",
  "jurisdiction": "federal",
  "court_system": "poder_judicial_federacion",
  "source_system": "scjn_bicentenario_repository",
  "doc_id": "mx-sjf-tesis-2031966",
  "registry_id": "2031966",
  "canonical_url": null,
  "source_url": "https://bicentenario.scjn.gob.mx/repositorio-scjn/api/v1/tesis/2031966",
  "retrieved_at": "2026-03-30T01:02:46.214281Z",
  "title": "INCIDENTE DE INEJECUCIÓN DE SENTENCIA EN AMPARO INDIRECTO. ES IMPROCEDENTE CUANDO EXISTE PRONUNCIAMIENTO PARCIAL DE LA PESONA JUZGADORA DEL INCUMPLIMIENTO DE LAS AUTORIDADES RESPONSABLES OBLIGADAS A SU ACATAMIENTO.",
  "rubro": "INCIDENTE DE INEJECUCIÓN DE SENTENCIA EN AMPARO INDIRECTO. ES IMPROCEDENTE CUANDO EXISTE PRONUNCIAMIENTO PARCIAL DE LA PESONA JUZGADORA DEL INCUMPLIMIENTO DE LAS AUTORIDADES RESPONSABLES OBLIGADAS A SU ACATAMIENTO.",
  "subtitle": null,
  "type": "Aislada",
  "epoch": "Duodécima Época",
  "instance": "Tribunales Colegiados de Circuito",
  "organ": "CUARTO TRIBUNAL COLEGIADO EN MATERIA ADMINISTRATIVA DEL SEGUNDO CIRCUITO.",
  "matter": [
    "Común"
  ],
  "case_type": null,
  "case_numbers": [],
  "publication_date": null,
  "binding_note_date": null,
  "mandatory_effect": null,
  "citation_label": "II.4o.A.2 K (12a.) | registro digital 2031966",
  "text": "Hechos: Un Juzgado de Distrito remitió los autos del amparo indirecto en que se concedió la protección constitucional al Tribunal Colegiado de Circuito para la sustanciación del incidente de inejecución de sentencia. Estimó que diversas autoridades responsables no habían dado cumplimiento a la ejecutoria de amparo. No obstante, se advirtió que no se agotó el procedimiento establecido en el artículo 193 de la Ley de Amparo, porque continuó formulando requerimientos a otras autoridades responsables para lograr su cumplimiento. Criterio jurídico: Es improcedente el incidente de inejecución de sentencia en amparo indirecto cuando existe pronunciamiento parcial de la persona juzgadora de amparo del incumplimiento de las autoridades responsables obligadas a su acatamiento, o de si lo hicieron de manera contumaz o defectuosa. Justificación: El artículo 193 de la Ley de Amparo prevé que para tramitar el incidente de inejecución de sentencia, tratándose de amparo indirecto, es necesario que previamente el Juzgado de Distrito haga el pronunciamiento en torno a si la ejecutoria protectora se encuentra cumplida o no, imponga las multas correspondientes a las autoridades responsables respectivas y sólo para el caso de que no esté cumplida, no lo esté total o correctamente, o bien, se considere de imposible cumplimiento, debe remitir los autos al Tribunal Colegiado de Circuito para que pronuncie la resolución que corresponda. Si bien el objeto del incidente de inejecución de sentencia es el estudio y determinación del incumplimiento por las autoridades responsables a una ejecutoria dictada en amparo cuando han sido requeridas, la propia ley no autoriza que el procedimiento de cumplimiento de las ejecutorias de amparo pueda fraccionarse, y por ello, el juzgador no está obligado ni facultado a dividirlo, por lo que dicho procedimiento debe guardar en todo momento unidad y orden. En consecuencia, cuando exista un pronunciamiento parcial del incumplimiento dado a la ejecutoria de amparo, el incidente señalado es improcedente, al no colmarse los requisitos de procedencia establecidos en el referido artículo 193, pues previamente a que se ordene abrirlo, se deben agotar los medios para su cumplimiento respecto de toda la sentencia. CUARTO TRIBUNAL COLEGIADO EN MATERIA ADMINISTRATIVA DEL SEGUNDO CIRCUITO.",
  "text_normalized": "hechos: un juzgado de distrito remitió los autos del amparo indirecto en que se concedió la protección constitucional al tribunal colegiado de circuito para la sustanciación del incidente de inejecución de sentencia. estimó que diversas autoridades responsables no habían dado cumplimiento a la ejecutoria de amparo. no obstante, se advirtió que no se agotó el procedimiento establecido en el artículo 193 de la ley de amparo, porque continuó formulando requerimientos a otras autoridades responsables para lograr su cumplimiento. criterio jurídico: es improcedente el incidente de inejecución de sentencia en amparo indirecto cuando existe pronunciamiento parcial de la persona juzgadora de amparo del incumplimiento de las autoridades responsables obligadas a su acatamiento, o de si lo hicieron de manera contumaz o defectuosa. justificación: el artículo 193 de la ley de amparo prevé que para tramitar el incidente de inejecución de sentencia, tratándose de amparo indirecto, es necesario que previamente el juzgado de distrito haga el pronunciamiento en torno a si la ejecutoria protectora se encuentra cumplida o no, imponga las multas correspondientes a las autoridades responsables respectivas y sólo para el caso de que no esté cumplida, no lo esté total o correctamente, o bien, se considere de imposible cumplimiento, debe remitir los autos al tribunal colegiado de circuito para que pronuncie la resolución que corresponda. si bien el objeto del incidente de inejecución de sentencia es el estudio y determinación del incumplimiento por las autoridades responsables a una ejecutoria dictada en amparo cuando han sido requeridas, la propia ley no autoriza que el procedimiento de cumplimiento de las ejecutorias de amparo pueda fraccionarse, y por ello, el juzgador no está obligado ni facultado a dividirlo, por lo que dicho procedimiento debe guardar en todo momento unidad y orden. en consecuencia, cuando exista un pronunciamiento parcial del incumplimiento dado a la ejecutoria de amparo, el incidente señalado es improcedente, al no colmarse los requisitos de procedencia establecidos en el referido artículo 193, pues previamente a que se ordene abrirlo, se deben agotar los medios para su cumplimiento respecto de toda la sentencia. cuarto tribunal colegiado en materia administrativa del segundo circuito.",
  "source_payload_path": "raw/scjn/payloads/tesis/2031966.json",
  "source_pdf_url": null,
  "source_pdf_path": null,
  "source_certificate_sha256": null,
  "parser_version": "scjn-tesis-normalizer-v1",
  "last_seen_at": null,
  "related_documents": [],
  "interpreted_norms": [],
  "status": "vigente_en_fuente",
  "text_checksum_sha256": "2e1e643d876c551f3dfa9bd919a8ea5b5a3c1c5aeb1b4156f1579992b9027852",
  "metadata_checksum_sha256": "52f000b8809ac58f924a27d1a85f6ef14645f6d82d6b29b89912008a2d3416d5"
}
