{
  "doc_type": "jurisprudence",
  "document_kind": "tesis",
  "country": "mx",
  "jurisdiction": "federal",
  "court_system": "poder_judicial_federacion",
  "source_system": "scjn_bicentenario_repository",
  "doc_id": "mx-sjf-tesis-2031982",
  "registry_id": "2031982",
  "canonical_url": null,
  "source_url": "https://bicentenario.scjn.gob.mx/repositorio-scjn/api/v1/tesis/2031982",
  "retrieved_at": "2026-03-30T00:51:01.160481Z",
  "title": "RÉGIMEN DE JUBILACIONES Y PENSIONES DEL INSTITUTO MEXICANO DEL SEGURO SOCIAL (IMSS). LA APLICACIÓN DE LA JURISPRUDENCIA PR.P.T.CS. J/64 L (11a.) NO IMPLICA RETROACTIVIDAD EN PERJUICIO DE LAS PERSONAS TRABAJADORAS.",
  "rubro": "RÉGIMEN DE JUBILACIONES Y PENSIONES DEL INSTITUTO MEXICANO DEL SEGURO SOCIAL (IMSS). LA APLICACIÓN DE LA JURISPRUDENCIA PR.P.T.CS. J/64 L (11a.) NO IMPLICA RETROACTIVIDAD EN PERJUICIO DE LAS PERSONAS TRABAJADORAS.",
  "subtitle": null,
  "type": "Aislada",
  "epoch": "Duodécima Época",
  "instance": "Tribunales Colegiados de Circuito",
  "organ": "DÉCIMO TRIBUNAL COLEGIADO EN MATERIA DE TRABAJO DEL PRIMER CIRCUITO.",
  "matter": [
    "Laboral"
  ],
  "case_type": null,
  "case_numbers": [],
  "publication_date": null,
  "binding_note_date": null,
  "mandatory_effect": null,
  "citation_label": "I.10o.T.1 L (12a.) | registro digital 2031982",
  "text": "Hechos: Personas trabajadoras jubiladas al 100 % por años de servicio reclamaron del Instituto Mexicano del Seguro Social (IMSS) el reconocimiento de enfermedades del orden profesional, en términos del Régimen de Jubilaciones y Pensiones y, como consecuencia, el pago de la pensión correspondiente, así como la indemnización prevista en la cláusula 89 del contrato colectivo de trabajo. Antes de 2025 la Junta condenó al reconocimiento de una incapacidad parcial permanente en un porcentaje determinado y al pago de la indemnización contemplada en la cláusula 89 del contrato colectivo de trabajo (en el mismo porcentaje), al considerar que la parte actora padece enfermedades del orden profesional que le ocasionan incapacidad. En suma, las prestaciones y pensiones otorgadas a las personas trabajadoras exceden el 100 % del sueldo que percibían cuando estaban en activo. En junio de 2025 el Pleno Regional en Materias Penal y de Trabajo de la Región Centro-Sur emitió criterio en el que sostuvo que el pago de dos o más pensiones a una sola persona no puede rebasar el límite establecido en los artículos 4 y 5 del mencionado régimen. Criterio jurídico: La aplicación de la jurisprudencia PR.P.T.CS. J/64 L (11a.), de rubro: \"RÉGIMEN DE JUBILACIONES Y PENSIONES DE LOS TRABAJADORES DEL INSTITUTO MEXICANO DEL SEGURO SOCIAL. EL PAGO DE DOS O MÁS PENSIONES A UNA SOLA PERSONA NO PUEDE REBASAR EL LÍMITE ESTABLECIDO EN SUS ARTÍCULOS 4 Y 5.\", en asuntos iniciados antes de su emisión, no implica aplicación retroactiva en perjuicio de la persona trabajadora. Justificación: Aun cuando la contradicción de criterios de la que derivó la jurisprudencia aludida se resolvió el 18 de junio de 2025, esto es, con posterioridad a la presentación de la demanda laboral e incluso a la emisión del laudo reclamado, no existía criterio obligatorio en el cual se hubiera sostenido que el Régimen de Jubilaciones y Pensiones inserto en el Contrato Colectivo de Trabajo del Instituto Mexicano del Seguro Social permitía la coexistencia de pensiones distintas, aun rebasando el 100 % del último salario percibido por el trabajador estando en activo. Por tanto, su aplicación carece de efectos retroactivos en perjuicio de persona alguna, ya que no existía un criterio jurisprudencial que interpretara o definiera esa hipótesis en específico. DÉCIMO TRIBUNAL COLEGIADO EN MATERIA DE TRABAJO DEL PRIMER CIRCUITO.",
  "text_normalized": "hechos: personas trabajadoras jubiladas al 100 % por años de servicio reclamaron del instituto mexicano del seguro social (imss) el reconocimiento de enfermedades del orden profesional, en términos del régimen de jubilaciones y pensiones y, como consecuencia, el pago de la pensión correspondiente, así como la indemnización prevista en la cláusula 89 del contrato colectivo de trabajo. antes de 2025 la junta condenó al reconocimiento de una incapacidad parcial permanente en un porcentaje determinado y al pago de la indemnización contemplada en la cláusula 89 del contrato colectivo de trabajo (en el mismo porcentaje), al considerar que la parte actora padece enfermedades del orden profesional que le ocasionan incapacidad. en suma, las prestaciones y pensiones otorgadas a las personas trabajadoras exceden el 100 % del sueldo que percibían cuando estaban en activo. en junio de 2025 el pleno regional en materias penal y de trabajo de la región centro-sur emitió criterio en el que sostuvo que el pago de dos o más pensiones a una sola persona no puede rebasar el límite establecido en los artículos 4 y 5 del mencionado régimen. criterio jurídico: la aplicación de la jurisprudencia pr.p.t.cs. j/64 l (11a.), de rubro: \"régimen de jubilaciones y pensiones de los trabajadores del instituto mexicano del seguro social. el pago de dos o más pensiones a una sola persona no puede rebasar el límite establecido en sus artículos 4 y 5.\", en asuntos iniciados antes de su emisión, no implica aplicación retroactiva en perjuicio de la persona trabajadora. justificación: aun cuando la contradicción de criterios de la que derivó la jurisprudencia aludida se resolvió el 18 de junio de 2025, esto es, con posterioridad a la presentación de la demanda laboral e incluso a la emisión del laudo reclamado, no existía criterio obligatorio en el cual se hubiera sostenido que el régimen de jubilaciones y pensiones inserto en el contrato colectivo de trabajo del instituto mexicano del seguro social permitía la coexistencia de pensiones distintas, aun rebasando el 100 % del último salario percibido por el trabajador estando en activo. por tanto, su aplicación carece de efectos retroactivos en perjuicio de persona alguna, ya que no existía un criterio jurisprudencial que interpretara o definiera esa hipótesis en específico. décimo tribunal colegiado en materia de trabajo del primer circuito.",
  "source_payload_path": "raw/scjn/payloads/tesis/2031982.json",
  "source_pdf_url": null,
  "source_pdf_path": null,
  "source_certificate_sha256": null,
  "parser_version": "scjn-tesis-normalizer-v1",
  "last_seen_at": null,
  "related_documents": [],
  "interpreted_norms": [],
  "status": "vigente_en_fuente",
  "text_checksum_sha256": "4aae57f3448bcbafc03b16df16a65af11392e4cd50a5ae230555ee4a6f77f9ec",
  "metadata_checksum_sha256": "5ff24703232faec06f7d6c538801b41d5208febc7d135e7c715ef1a7b54bfba1"
}
