{
  "doc_type": "jurisprudence",
  "document_kind": "tesis",
  "country": "mx",
  "jurisdiction": "federal",
  "court_system": "poder_judicial_federacion",
  "source_system": "scjn_bicentenario_repository",
  "doc_id": "mx-sjf-tesis-2031979",
  "registry_id": "2031979",
  "canonical_url": null,
  "source_url": "https://bicentenario.scjn.gob.mx/repositorio-scjn/api/v1/tesis/2031979",
  "retrieved_at": "2026-03-30T00:51:02.448654Z",
  "title": "PRUEBA DE ESCUCHA O INTERVENCIÓN TELEFÓNICA POLICIAL. PARA OTORGARLE EFICACIA PROBATORIA EL MINISTERIO PÚBLICO DEBE PERFECCIONARLA EN JUICIO, EN TÉRMINOS DE LA REGLA APLICABLE AL TESTIMONIO DE UN ELEMENTO POLICIAL.",
  "rubro": "PRUEBA DE ESCUCHA O INTERVENCIÓN TELEFÓNICA POLICIAL. PARA OTORGARLE EFICACIA PROBATORIA EL MINISTERIO PÚBLICO DEBE PERFECCIONARLA EN JUICIO, EN TÉRMINOS DE LA REGLA APLICABLE AL TESTIMONIO DE UN ELEMENTO POLICIAL.",
  "subtitle": null,
  "type": "Jurisprudencia",
  "epoch": "Duodécima Época",
  "instance": "Tribunales Colegiados de Circuito",
  "organ": "SEGUNDO TRIBUNAL COLEGIADO EN MATERIA PENAL DEL SEGUNDO CIRCUITO.",
  "matter": [
    "Penal"
  ],
  "case_type": null,
  "case_numbers": [],
  "publication_date": null,
  "binding_note_date": null,
  "mandatory_effect": null,
  "citation_label": "II.2o.P. J/1 P (12a.) | registro digital 2031979",
  "text": "Hechos: En diversos procesos penales el Ministerio Público formuló acusación contra diversas personas por el delito de delincuencia organizada, atribuyéndoles funciones específicas dentro de la organización criminal tales como administrar, dirigir o supervisar actividades ilícitas, o bien, haberse incorporado a una organización previamente existente. Durante el juicio la Fiscalía ofreció como sustento probatorio testimonios de agentes policiales derivados de una denuncia anónima, entrevistas a diversas personas e intervenciones telefónicas. Sin embargo, no se exhibió tal denuncia, no comparecieron las personas entrevistadas, ni se perfeccionaron las intervenciones telefónicas en cuanto a la identificación de las personas que participaron en las llamadas, su origen, autenticidad o contexto. El Tribunal de Enjuiciamiento dictó sentencia condenatoria, la cual fue confirmada por los tribunales de apelación, quienes tuvieron por acreditada la existencia del delito, así como la responsabilidad penal de los acusados, con base en los referidos medios de prueba. Inconformes, los sentenciados promovieron amparo directo. Criterio jurídico: La regla de ponderación probatoria que exige que el testimonio de un elemento policial en ejercicio de su función investigadora se sustente en juicio con el dicho de la persona que adujo haber entrevistado, también debe observarse cuando el órgano jurisdiccional valore la eficacia demostrativa de la prueba de escucha o intervención telefónica policial. Justificación: En la jurisprudencia PR.P.T.CN. J/10 P (11a.), el Pleno Regional en Materias Penal y de Trabajo de la Región Centro-Norte, con residencia en la Ciudad de México, estableció que si el testimonio de un elemento policial deriva de su actividad investigadora, debe corroborarse en juicio mediante la comparecencia de la persona entrevistada, pues de lo contrario se trataría de prueba de referencia carente de eficacia plena. Esa misma regla debe aplicarse tratándose de la prueba de escucha o intervención telefónica policial cuando su contenido se introduce al proceso a través del dicho de agentes investigadores. En tales casos, corresponde al Ministerio Público perfeccionar la prueba en juicio, acreditando su obtención legal, autenticidad, integridad y la identidad de quienes participaron en la comunicación, pues de lo contrario no se tendría certeza de su origen. Ello obedece a que la intervención de comunicaciones privadas constituye una medida de máxima injerencia en derechos fundamentales, particularmente en los de privacidad y al secreto de las comunicaciones, cuya validez probatoria exige un estándar reforzado de control constitucional y procesal. SEGUNDO TRIBUNAL COLEGIADO EN MATERIA PENAL DEL SEGUNDO CIRCUITO.",
  "text_normalized": "hechos: en diversos procesos penales el ministerio público formuló acusación contra diversas personas por el delito de delincuencia organizada, atribuyéndoles funciones específicas dentro de la organización criminal tales como administrar, dirigir o supervisar actividades ilícitas, o bien, haberse incorporado a una organización previamente existente. durante el juicio la fiscalía ofreció como sustento probatorio testimonios de agentes policiales derivados de una denuncia anónima, entrevistas a diversas personas e intervenciones telefónicas. sin embargo, no se exhibió tal denuncia, no comparecieron las personas entrevistadas, ni se perfeccionaron las intervenciones telefónicas en cuanto a la identificación de las personas que participaron en las llamadas, su origen, autenticidad o contexto. el tribunal de enjuiciamiento dictó sentencia condenatoria, la cual fue confirmada por los tribunales de apelación, quienes tuvieron por acreditada la existencia del delito, así como la responsabilidad penal de los acusados, con base en los referidos medios de prueba. inconformes, los sentenciados promovieron amparo directo. criterio jurídico: la regla de ponderación probatoria que exige que el testimonio de un elemento policial en ejercicio de su función investigadora se sustente en juicio con el dicho de la persona que adujo haber entrevistado, también debe observarse cuando el órgano jurisdiccional valore la eficacia demostrativa de la prueba de escucha o intervención telefónica policial. justificación: en la jurisprudencia pr.p.t.cn. j/10 p (11a.), el pleno regional en materias penal y de trabajo de la región centro-norte, con residencia en la ciudad de méxico, estableció que si el testimonio de un elemento policial deriva de su actividad investigadora, debe corroborarse en juicio mediante la comparecencia de la persona entrevistada, pues de lo contrario se trataría de prueba de referencia carente de eficacia plena. esa misma regla debe aplicarse tratándose de la prueba de escucha o intervención telefónica policial cuando su contenido se introduce al proceso a través del dicho de agentes investigadores. en tales casos, corresponde al ministerio público perfeccionar la prueba en juicio, acreditando su obtención legal, autenticidad, integridad y la identidad de quienes participaron en la comunicación, pues de lo contrario no se tendría certeza de su origen. ello obedece a que la intervención de comunicaciones privadas constituye una medida de máxima injerencia en derechos fundamentales, particularmente en los de privacidad y al secreto de las comunicaciones, cuya validez probatoria exige un estándar reforzado de control constitucional y procesal. segundo tribunal colegiado en materia penal del segundo circuito.",
  "source_payload_path": "raw/scjn/payloads/tesis/2031979.json",
  "source_pdf_url": null,
  "source_pdf_path": null,
  "source_certificate_sha256": null,
  "parser_version": "scjn-tesis-normalizer-v1",
  "last_seen_at": null,
  "related_documents": [],
  "interpreted_norms": [],
  "status": "vigente_en_fuente",
  "text_checksum_sha256": "37ad13dc30a096b4ba0082b48daa2667d3aa4583cb4a14fe246a05b61062ac37",
  "metadata_checksum_sha256": "5b902c8bcc485f4ee146939771a96ac42194e0dccd7b87d4d7e3d1549dbdf3ba"
}
