{
  "doc_type": "jurisprudence",
  "document_kind": "tesis",
  "country": "mx",
  "jurisdiction": "federal",
  "court_system": "poder_judicial_federacion",
  "source_system": "scjn_bicentenario_repository",
  "doc_id": "mx-sjf-tesis-2031987",
  "registry_id": "2031987",
  "canonical_url": null,
  "source_url": "https://bicentenario.scjn.gob.mx/repositorio-scjn/api/v1/tesis/2031987",
  "retrieved_at": "2026-03-30T00:50:59.291990Z",
  "title": "SUSPENSIÓN DE LA CERTIFICACIÓN DE PERSONAS FACILITADORAS EN MECANISMOS ALTERNATIVOS DE SOLUCIÓN DE CONTROVERSIAS. LOS ARTÍCULOS 50, PÁRRAFO ÚLTIMO, 51 Y 131, FRACCIONES II, IV Y VI, DE LA LEY RELATIVA DEL ESTADO DE VERACRUZ VULNERAN EL PRINCIPIO DE EXACTA APLICACIÓN DE LA LEY EN SU VERTIENTE DE TAXATIVIDAD.",
  "rubro": "SUSPENSIÓN DE LA CERTIFICACIÓN DE PERSONAS FACILITADORAS EN MECANISMOS ALTERNATIVOS DE SOLUCIÓN DE CONTROVERSIAS. LOS ARTÍCULOS 50, PÁRRAFO ÚLTIMO, 51 Y 131, FRACCIONES II, IV Y VI, DE LA LEY RELATIVA DEL ESTADO DE VERACRUZ VULNERAN EL PRINCIPIO DE EXACTA APLICACIÓN DE LA LEY EN SU VERTIENTE DE TAXATIVIDAD.",
  "subtitle": null,
  "type": "Jurisprudencia",
  "epoch": "Duodécima Época",
  "instance": "Suprema Corte de Justicia de la Nación",
  "organ": "Pleno",
  "matter": [
    "Común"
  ],
  "case_type": null,
  "case_numbers": [],
  "publication_date": null,
  "binding_note_date": null,
  "mandatory_effect": null,
  "citation_label": "P./J. 45/2026 (12a.) | registro digital 2031987",
  "text": "Hechos: La Presidenta de la Comisión Nacional de los Derechos Humanos promovió acción de inconstitucionalidad contra los artículos referidos que establecen las causas que pueden motivar la suspensión de la certificación de las personas facilitadoras que intervienen en los mecanismos alternativos de solución de controversias en la entidad, así como las sanciones que se impondrán por infracciones a la citada ley (sanción económica, suspensión de la certificación e inhabilitación), al considerar que contravienen el derecho a la seguridad jurídica y el principio de taxatividad aplicable en el derecho administrativo sancionador, pues a su parecer no fijan algún parámetro de graduación en un mínimo y un máximo que permita a la autoridad llevar a cabo la individualización de la sanción. Criterio jurídico: Los artículos 50, párrafo último, 51 y 131, fracciones II, IV y VI, de la Ley Número 230 de Mecanismos Alternativos de Solución de Controversias del Estado de Veracruz, vulneran el principio de exacta aplicación de la ley en su vertiente de taxatividad consagrado en el artículo 14 de la Constitución Política de los Estados Unidos Mexicanos, porque si bien describen las sanciones (sanción económica, suspensión de la certificación e inhabilitación) y las causas que las pueden motivar, no establecen parámetros objetivos mínimos ni máximos que limiten la actuación de la autoridad al momento de determinar la duración de las suspensiones o inhabilitaciones, ni la cuantía de las sanciones económicas, permitiendo actuar arbitrariamente. Justificación: La Suprema Corte de Justicia de la Nación ha establecido que los principios básicos del derecho penal son aplicables al derecho administrativo sancionador, con matices o modulaciones, porque ambas materias son parte de un genérico ius puniendi del Estado que comparten principios similares. Uno de esos principios es el de exacta aplicación de la ley en materia penal reconocido en el artículo 14, párrafo tercero, de la Constitución Federal que, en su vertiente de taxatividad, exige que la conducta prohibida en los tipos penales se describa con exactitud y claridad, y que la autoridad legislativa, al prever las penas, incluya todos sus elementos, características, condiciones, términos y plazos, pues ello es necesario para evitar confusiones en su aplicación o demérito en la defensa de la persona procesada. De ahí que las normas impugnadas, al no establecer parámetros objetivos mínimos y máximos para determinar la duración de la suspensión de la certificación de las personas facilitadoras que intervienen en los mecanismos alternativos de solución de controversias, ni para establecer la multa, la suspensión de la certificación o la inhabilitación por las infracciones que se cometan a la Ley de Mecanismos Alternativos de Solución de Controversias de la entidad, incumplen con la exigencia de taxatividad. Si bien las disposiciones describen las sanciones y las causas que las pueden motivar, lo cierto es que generan un grado de indeterminación que provoca en los destinatarios incertidumbre en cuanto al límite de la sanción, pues permiten a la autoridad actuar arbitrariamente, debido a que no contemplan elementos objetivos que limiten su actuación al momento de determinar las sanciones, como puede ser el vinculado en función de días, meses o años, tratándose de la suspensión o inhabilitación, o bien, en razón de cuantía tratándose de la sanción económica. PLENO.",
  "text_normalized": "hechos: la presidenta de la comisión nacional de los derechos humanos promovió acción de inconstitucionalidad contra los artículos referidos que establecen las causas que pueden motivar la suspensión de la certificación de las personas facilitadoras que intervienen en los mecanismos alternativos de solución de controversias en la entidad, así como las sanciones que se impondrán por infracciones a la citada ley (sanción económica, suspensión de la certificación e inhabilitación), al considerar que contravienen el derecho a la seguridad jurídica y el principio de taxatividad aplicable en el derecho administrativo sancionador, pues a su parecer no fijan algún parámetro de graduación en un mínimo y un máximo que permita a la autoridad llevar a cabo la individualización de la sanción. criterio jurídico: los artículos 50, párrafo último, 51 y 131, fracciones ii, iv y vi, de la ley número 230 de mecanismos alternativos de solución de controversias del estado de veracruz, vulneran el principio de exacta aplicación de la ley en su vertiente de taxatividad consagrado en el artículo 14 de la constitución política de los estados unidos mexicanos, porque si bien describen las sanciones (sanción económica, suspensión de la certificación e inhabilitación) y las causas que las pueden motivar, no establecen parámetros objetivos mínimos ni máximos que limiten la actuación de la autoridad al momento de determinar la duración de las suspensiones o inhabilitaciones, ni la cuantía de las sanciones económicas, permitiendo actuar arbitrariamente. justificación: la suprema corte de justicia de la nación ha establecido que los principios básicos del derecho penal son aplicables al derecho administrativo sancionador, con matices o modulaciones, porque ambas materias son parte de un genérico ius puniendi del estado que comparten principios similares. uno de esos principios es el de exacta aplicación de la ley en materia penal reconocido en el artículo 14, párrafo tercero, de la constitución federal que, en su vertiente de taxatividad, exige que la conducta prohibida en los tipos penales se describa con exactitud y claridad, y que la autoridad legislativa, al prever las penas, incluya todos sus elementos, características, condiciones, términos y plazos, pues ello es necesario para evitar confusiones en su aplicación o demérito en la defensa de la persona procesada. de ahí que las normas impugnadas, al no establecer parámetros objetivos mínimos y máximos para determinar la duración de la suspensión de la certificación de las personas facilitadoras que intervienen en los mecanismos alternativos de solución de controversias, ni para establecer la multa, la suspensión de la certificación o la inhabilitación por las infracciones que se cometan a la ley de mecanismos alternativos de solución de controversias de la entidad, incumplen con la exigencia de taxatividad. si bien las disposiciones describen las sanciones y las causas que las pueden motivar, lo cierto es que generan un grado de indeterminación que provoca en los destinatarios incertidumbre en cuanto al límite de la sanción, pues permiten a la autoridad actuar arbitrariamente, debido a que no contemplan elementos objetivos que limiten su actuación al momento de determinar las sanciones, como puede ser el vinculado en función de días, meses o años, tratándose de la suspensión o inhabilitación, o bien, en razón de cuantía tratándose de la sanción económica. pleno.",
  "source_payload_path": "raw/scjn/payloads/tesis/2031987.json",
  "source_pdf_url": null,
  "source_pdf_path": null,
  "source_certificate_sha256": null,
  "parser_version": "scjn-tesis-normalizer-v1",
  "last_seen_at": null,
  "related_documents": [],
  "interpreted_norms": [],
  "status": "vigente_en_fuente",
  "text_checksum_sha256": "5af94f5b6ff22d59e99a0432ea44617b1076ee1b524d790fb7399547623b9571",
  "metadata_checksum_sha256": "29c41b9e0112390b3147d96fa9afd6584f9d8c94672d8cc58aad3faa19e0af04"
}
