{
  "doc_type": "jurisprudence",
  "document_kind": "tesis",
  "country": "mx",
  "jurisdiction": "federal",
  "court_system": "poder_judicial_federacion",
  "source_system": "scjn_sjf",
  "doc_id": "mx-sjf-tesis-2006737",
  "registry_id": "2006737",
  "canonical_url": null,
  "source_url": "https://www.scjn.gob.mx/sites/default/files/pagina_transparencia/documento/2016-11/Criterios_PJF_Proteccion_datos_2a_Ed_Feb_2016.pdf",
  "retrieved_at": "2026-03-30T00:00:00Z",
  "title": "DAÑO MORAL. SU CLASIFICACIÓN EN CUANTO AL CARÁCTER DEL INTERÉS AFECTADO.",
  "rubro": "DAÑO MORAL. SU CLASIFICACIÓN EN CUANTO AL CARÁCTER DEL INTERÉS AFECTADO.",
  "subtitle": null,
  "type": null,
  "epoch": "Décima Época",
  "instance": "Primera Sala",
  "organ": "Primera Sala",
  "matter": [
    "Civil"
  ],
  "case_type": null,
  "case_numbers": [],
  "publication_date": "2014-06-20",
  "binding_note_date": null,
  "mandatory_effect": null,
  "citation_label": "Tesis con registro digital 2006737",
  "text": "En nuestro ordenamiento jurídico se plantea una distinción en el tratamiento de la responsabilidad por daño al patrimonio moral, dependiendo de su carácter. En efecto, puede sostenerse que el daño moral es un género dividido en tres especies, a saber: (i) daño al honor, el cual afecta a una persona en su vida privada, honor o propia imagen; (ii) daños estéticos, que son los que afectan la configuración y los aspectos físicos de las personas; y, (iii) daños a los sentimientos o a la parte afectiva del patrimonio moral, como se les ha denominado en la doctrina, y que hieren a un individuo en sus afectos.",
  "text_normalized": "en nuestro ordenamiento jurídico se plantea una distinción en el tratamiento de la responsabilidad por daño al patrimonio moral, dependiendo de su carácter. en efecto, puede sostenerse que el daño moral es un género dividido en tres especies, a saber: (i) daño al honor, el cual afecta a una persona en su vida privada, honor o propia imagen; (ii) daños estéticos, que son los que afectan la configuración y los aspectos físicos de las personas; y, (iii) daños a los sentimientos o a la parte afectiva del patrimonio moral, como se les ha denominado en la doctrina, y que hieren a un individuo en sus afectos.",
  "source_payload_path": "/root/legalize-mx/fixtures/scjn_tesis_2006737_raw.json",
  "source_pdf_url": null,
  "source_pdf_path": null,
  "source_certificate_sha256": null,
  "parser_version": "scjn-tesis-normalizer-v1",
  "last_seen_at": "2026-03-30T00:00:00Z",
  "related_documents": [],
  "interpreted_norms": [],
  "status": "vigente_en_fuente",
  "text_checksum_sha256": "3554dc094f5407a753d503a4b385a910a40e26ff71b0bc242807075fa527e251",
  "metadata_checksum_sha256": "9df28cba12c687ec81b6a0eaf5031e9aeb30abc958373e84e59dc0b264f3e9b9"
}
