{
  "doc_type": "jurisprudence",
  "document_kind": "tesis",
  "country": "mx",
  "jurisdiction": "federal",
  "court_system": "poder_judicial_federacion",
  "source_system": "scjn_bicentenario_repository",
  "doc_id": "mx-sjf-tesis-2031980",
  "registry_id": "2031980",
  "canonical_url": null,
  "source_url": "https://bicentenario.scjn.gob.mx/repositorio-scjn/api/v1/tesis/2031980",
  "retrieved_at": "2026-03-30T00:51:02.137205Z",
  "title": "RECURSO DE REVISIÓN CONTRA LA INTERLOCUTORIA QUE RESUELVE SOBRE LA SUSPENSIÓN DEFINITIVA. QUEDA SIN MATERIA SI CAUSA FIRMEZA LA RESOLUCIÓN QUE PONE FIN AL JUICIO DE AMPARO.",
  "rubro": "RECURSO DE REVISIÓN CONTRA LA INTERLOCUTORIA QUE RESUELVE SOBRE LA SUSPENSIÓN DEFINITIVA. QUEDA SIN MATERIA SI CAUSA FIRMEZA LA RESOLUCIÓN QUE PONE FIN AL JUICIO DE AMPARO.",
  "subtitle": null,
  "type": "Aislada",
  "epoch": "Duodécima Época",
  "instance": "Tribunales Colegiados de Circuito",
  "organ": "TERCER TRIBUNAL COLEGIADO EN MATERIA CIVIL DEL TERCER CIRCUITO.",
  "matter": [
    "Común"
  ],
  "case_type": null,
  "case_numbers": [],
  "publication_date": null,
  "binding_note_date": null,
  "mandatory_effect": null,
  "citation_label": "III.3o.C.5 K (12a.) | registro digital 2031980",
  "text": "Hechos: Una persona interpuso recurso de revisión incidental contra la interlocutoria que resolvió y negó la suspensión definitiva en amparo indirecto. Previo a su resolución el Juzgado de Distrito dictó sentencia en el juicio constitucional que causó ejecutoria. Criterio jurídico: La revisión incidental queda sin materia si causa firmeza la resolución que resuelve en definitiva sobre la acción constitucional. Justificación: Si conforme al artículo 130 de la Ley de Amparo la suspensión tiene vigencia mientras no se dicte sentencia ejecutoria en el juicio de amparo, entonces si ya fue fallado el negocio en lo principal y se emitió acuerdo en el que se declaró ejecutoriada la sentencia, es claro que carece de materia la revisión incidental. TERCER TRIBUNAL COLEGIADO EN MATERIA CIVIL DEL TERCER CIRCUITO.",
  "text_normalized": "hechos: una persona interpuso recurso de revisión incidental contra la interlocutoria que resolvió y negó la suspensión definitiva en amparo indirecto. previo a su resolución el juzgado de distrito dictó sentencia en el juicio constitucional que causó ejecutoria. criterio jurídico: la revisión incidental queda sin materia si causa firmeza la resolución que resuelve en definitiva sobre la acción constitucional. justificación: si conforme al artículo 130 de la ley de amparo la suspensión tiene vigencia mientras no se dicte sentencia ejecutoria en el juicio de amparo, entonces si ya fue fallado el negocio en lo principal y se emitió acuerdo en el que se declaró ejecutoriada la sentencia, es claro que carece de materia la revisión incidental. tercer tribunal colegiado en materia civil del tercer circuito.",
  "source_payload_path": "raw/scjn/payloads/tesis/2031980.json",
  "source_pdf_url": null,
  "source_pdf_path": null,
  "source_certificate_sha256": null,
  "parser_version": "scjn-tesis-normalizer-v1",
  "last_seen_at": null,
  "related_documents": [],
  "interpreted_norms": [],
  "status": "vigente_en_fuente",
  "text_checksum_sha256": "0ffc32119f562a080ad032bfccc554de470ddcfe8ae8f72838753f2474b9aebc",
  "metadata_checksum_sha256": "a3f79b089de55a7327684b9c3440b81a2bb0a994b72be9129ef647f1c6416091"
}
