{
  "doc_type": "jurisprudence",
  "document_kind": "tesis",
  "country": "mx",
  "jurisdiction": "federal",
  "court_system": "poder_judicial_federacion",
  "source_system": "scjn_bicentenario_repository",
  "doc_id": "mx-sjf-tesis-2031964",
  "registry_id": "2031964",
  "canonical_url": null,
  "source_url": "https://bicentenario.scjn.gob.mx/repositorio-scjn/api/v1/tesis/2031964",
  "retrieved_at": "2026-03-30T01:02:46.826678Z",
  "title": "DEMANDA DEL JUICIO CONTENCIOSO ADMINISTRATIVO EN EL ESTADO DE GUANAJUATO. PUEDE PRESENTARSE EN CUALQUIER TIEMPO CUANDO EN UNA BOLETA DE INFRACCIÓN LA AUTORIDAD OMITE SEÑALAR EL MEDIO DE DEFENSA PROCEDENTE, LA AUTORIDAD ANTE LA QUE DEBE INTERPONERSE Y EL PLAZO PARA ELLO (LEGISLACIÓN VIGENTE HASTA EL 3 DE NOVIEMBRE DE 2025).",
  "rubro": "DEMANDA DEL JUICIO CONTENCIOSO ADMINISTRATIVO EN EL ESTADO DE GUANAJUATO. PUEDE PRESENTARSE EN CUALQUIER TIEMPO CUANDO EN UNA BOLETA DE INFRACCIÓN LA AUTORIDAD OMITE SEÑALAR EL MEDIO DE DEFENSA PROCEDENTE, LA AUTORIDAD ANTE LA QUE DEBE INTERPONERSE Y EL PLAZO PARA ELLO (LEGISLACIÓN VIGENTE HASTA EL 3 DE NOVIEMBRE DE 2025).",
  "subtitle": null,
  "type": "Jurisprudencia",
  "epoch": "Duodécima Época",
  "instance": "Plenos Regionales",
  "organ": "PLENO REGIONAL EN MATERIAS ADMINISTRATIVA Y CIVIL DE LA REGIÓN CENTRO-NORTE, CON RESIDENCIA EN LA CIUDAD DE MÉXICO",
  "matter": [
    "Administrativa"
  ],
  "case_type": null,
  "case_numbers": [],
  "publication_date": null,
  "binding_note_date": null,
  "mandatory_effect": null,
  "citation_label": "PR.A.C.CN. J/31 A (12a.) | registro digital 2031964",
  "text": "Hechos: Los Tribunales Colegiados de Circuito contendientes sustentaron criterios contradictorios al analizar el plazo para presentar la demanda de nulidad cuando se impugna una boleta de infracción de tránsito levantada por un policía de tránsito municipal en la que se omitió especificar el medio de defensa procedente, la autoridad ante la cual debía interponerse y el plazo para ello, previsto como requisito de validez del acto administrativo en el artículo 138, fracción V, del Código de Procedimiento y Justicia Administrativa para el Estado y los Municipios de Guanajuato. Mientras que uno estimó que la consecuencia jurídica consiste en que pueda presentarse en cualquier momento; el otro consideró que el efecto es duplicar el plazo para su presentación, de quince a treinta días. Criterio jurídico: Cuando en la boleta de infracción la autoridad omite señalar el medio de defensa procedente, la autoridad ante quien debe presentarse y el plazo para ello, la demanda de nulidad en su contra puede presentarse en cualquier tiempo. Justificación: Conforme a la interpretación literal y finalista del artículo 138, fracción V, del Código de Procedimiento y Justicia Administrativa para el Estado y los Municipios de Guanajuato, así como a lo resuelto en casos análogos por el Máximo Tribunal, y a la luz de los principios constitucionales de acceso a la justicia, de legalidad, de seguridad jurídica, de interpretación conforme, pro persona y pro actione, deriva que si la autoridad omite señalar los requisitos de validez del acto administrativo indicados la demanda de nulidad puede presentarse en cualquier tiempo. Ello, porque si bien el código aludido, en su texto anterior a la reforma publicada en el Periódico Oficial del Estado de Guanajuato el 3 de noviembre de 2025, no prevé la consecuencia de que la autoridad administrativa omita señalarlos, la interpretación realizada favorece más a la persona, pues privilegia la tramitación del proceso respectivo, le brinda mayor certeza jurídica y le garantiza el ejercicio efectivo y oportuno de su derecho de defensa. PLENO REGIONAL EN MATERIAS ADMINISTRATIVA Y CIVIL DE LA REGIÓN CENTRO-NORTE, CON RESIDENCIA EN LA CIUDAD DE MÉXICO",
  "text_normalized": "hechos: los tribunales colegiados de circuito contendientes sustentaron criterios contradictorios al analizar el plazo para presentar la demanda de nulidad cuando se impugna una boleta de infracción de tránsito levantada por un policía de tránsito municipal en la que se omitió especificar el medio de defensa procedente, la autoridad ante la cual debía interponerse y el plazo para ello, previsto como requisito de validez del acto administrativo en el artículo 138, fracción v, del código de procedimiento y justicia administrativa para el estado y los municipios de guanajuato. mientras que uno estimó que la consecuencia jurídica consiste en que pueda presentarse en cualquier momento; el otro consideró que el efecto es duplicar el plazo para su presentación, de quince a treinta días. criterio jurídico: cuando en la boleta de infracción la autoridad omite señalar el medio de defensa procedente, la autoridad ante quien debe presentarse y el plazo para ello, la demanda de nulidad en su contra puede presentarse en cualquier tiempo. justificación: conforme a la interpretación literal y finalista del artículo 138, fracción v, del código de procedimiento y justicia administrativa para el estado y los municipios de guanajuato, así como a lo resuelto en casos análogos por el máximo tribunal, y a la luz de los principios constitucionales de acceso a la justicia, de legalidad, de seguridad jurídica, de interpretación conforme, pro persona y pro actione, deriva que si la autoridad omite señalar los requisitos de validez del acto administrativo indicados la demanda de nulidad puede presentarse en cualquier tiempo. ello, porque si bien el código aludido, en su texto anterior a la reforma publicada en el periódico oficial del estado de guanajuato el 3 de noviembre de 2025, no prevé la consecuencia de que la autoridad administrativa omita señalarlos, la interpretación realizada favorece más a la persona, pues privilegia la tramitación del proceso respectivo, le brinda mayor certeza jurídica y le garantiza el ejercicio efectivo y oportuno de su derecho de defensa. pleno regional en materias administrativa y civil de la región centro-norte, con residencia en la ciudad de méxico",
  "source_payload_path": "raw/scjn/payloads/tesis/2031964.json",
  "source_pdf_url": null,
  "source_pdf_path": null,
  "source_certificate_sha256": null,
  "parser_version": "scjn-tesis-normalizer-v1",
  "last_seen_at": null,
  "related_documents": [],
  "interpreted_norms": [],
  "status": "vigente_en_fuente",
  "text_checksum_sha256": "4e7b5d6264bf36b442e38c67dd656bbe4b92c4262022febe96555faa973da070",
  "metadata_checksum_sha256": "7f27f2a34c3ddcb7aca45964c8e2e12806e05132851e5f50a54f8c912e058c4d"
}
