{
  "doc_type": "jurisprudence",
  "document_kind": "tesis",
  "country": "mx",
  "jurisdiction": "federal",
  "court_system": "poder_judicial_federacion",
  "source_system": "scjn_bicentenario_repository",
  "doc_id": "mx-sjf-tesis-2031962",
  "registry_id": "2031962",
  "canonical_url": null,
  "source_url": "https://bicentenario.scjn.gob.mx/repositorio-scjn/api/v1/tesis/2031962",
  "retrieved_at": "2026-03-30T01:02:47.407866Z",
  "title": "DELINCUENCIA ORGANIZADA. LA TEORÍA DE ACUSACIÓN DELIMITA EL MARCO FÁCTICO DE DECISIÓN JUDICIAL, POR LO QUE EL ÓRGANO JURISDICCIONAL DEBE RESOLVER CONFORME A LAS MODALIDADES DE INTERVENCIÓN PRECISADAS POR EL MINISTERIO PÚBLICO.",
  "rubro": "DELINCUENCIA ORGANIZADA. LA TEORÍA DE ACUSACIÓN DELIMITA EL MARCO FÁCTICO DE DECISIÓN JUDICIAL, POR LO QUE EL ÓRGANO JURISDICCIONAL DEBE RESOLVER CONFORME A LAS MODALIDADES DE INTERVENCIÓN PRECISADAS POR EL MINISTERIO PÚBLICO.",
  "subtitle": null,
  "type": "Jurisprudencia",
  "epoch": "Duodécima Época",
  "instance": "Tribunales Colegiados de Circuito",
  "organ": "SEGUNDO TRIBUNAL COLEGIADO EN MATERIA PENAL DEL SEGUNDO CIRCUITO.",
  "matter": [
    "Penal"
  ],
  "case_type": null,
  "case_numbers": [],
  "publication_date": null,
  "binding_note_date": null,
  "mandatory_effect": null,
  "citation_label": "II.2o.P. J/3 P (12a.) | registro digital 2031962",
  "text": "Hechos: En diversos procesos penales el Ministerio Público formuló acusación contra diversas personas por el delito de delincuencia organizada, atribuyéndoles funciones específicas dentro de la organización criminal tales como administrar, dirigir o supervisar actividades ilícitas, o bien, haberse incorporado a una organización previamente existente. Durante el juicio la Fiscalía ofreció como sustento probatorio testimonios de agentes policiales derivados de una denuncia anónima, entrevistas a diversas personas e intervenciones telefónicas. Sin embargo, no se exhibió tal denuncia, no comparecieron las personas entrevistadas, ni se perfeccionaron las intervenciones telefónicas en cuanto a la identificación de las personas que participaron en las llamadas, su origen, autenticidad o contexto. El Tribunal de Enjuiciamiento dictó sentencia condenatoria, la cual fue confirmada por los tribunales de apelación, quienes tuvieron por acreditada la existencia del delito, así como la responsabilidad penal de los acusados, con base en los referidos medios de prueba. Inconformes, los sentenciados promovieron amparo directo. Criterio jurídico: La teoría de acusación constituye el eje fáctico que delimita el ámbito de decisión del órgano jurisdiccional, por lo que tratándose del delito de delincuencia organizada, la resolución debe ser congruente con los hechos y modalidades de intervención precisados por el Ministerio Público, conforme a los artículos 21 constitucional y 68 del Código Nacional de Procedimientos Penales. Justificación: Tratándose del delito de delincuencia organizada previsto en los artículos 2o., párrafo primero, y 4o. de la Ley Federal contra la Delincuencia Organizada, la modalidad atribuida –ya sea integrar, organizar, dirigir, administrar o supervisar– constituye un elemento esencial que debe ser específicamente analizado y acreditado conforme a la hipótesis acusatoria. En consecuencia, el órgano jurisdiccional debe verificar si los elementos probatorios corresponden con la forma de intervención concretamente imputada; de no hacerlo, se vulneran los principios de congruencia, acusación, presunción de inocencia, imparcialidad judicial y defensa adecuada, reconocidos en los artículos 14, 16, 17, 19 y 21 de la Constitución Federal, al dictarse una resolución que excede o se aparta del marco fáctico delimitado por la Fiscalía. SEGUNDO TRIBUNAL COLEGIADO EN MATERIA PENAL DEL SEGUNDO CIRCUITO.",
  "text_normalized": "hechos: en diversos procesos penales el ministerio público formuló acusación contra diversas personas por el delito de delincuencia organizada, atribuyéndoles funciones específicas dentro de la organización criminal tales como administrar, dirigir o supervisar actividades ilícitas, o bien, haberse incorporado a una organización previamente existente. durante el juicio la fiscalía ofreció como sustento probatorio testimonios de agentes policiales derivados de una denuncia anónima, entrevistas a diversas personas e intervenciones telefónicas. sin embargo, no se exhibió tal denuncia, no comparecieron las personas entrevistadas, ni se perfeccionaron las intervenciones telefónicas en cuanto a la identificación de las personas que participaron en las llamadas, su origen, autenticidad o contexto. el tribunal de enjuiciamiento dictó sentencia condenatoria, la cual fue confirmada por los tribunales de apelación, quienes tuvieron por acreditada la existencia del delito, así como la responsabilidad penal de los acusados, con base en los referidos medios de prueba. inconformes, los sentenciados promovieron amparo directo. criterio jurídico: la teoría de acusación constituye el eje fáctico que delimita el ámbito de decisión del órgano jurisdiccional, por lo que tratándose del delito de delincuencia organizada, la resolución debe ser congruente con los hechos y modalidades de intervención precisados por el ministerio público, conforme a los artículos 21 constitucional y 68 del código nacional de procedimientos penales. justificación: tratándose del delito de delincuencia organizada previsto en los artículos 2o., párrafo primero, y 4o. de la ley federal contra la delincuencia organizada, la modalidad atribuida –ya sea integrar, organizar, dirigir, administrar o supervisar– constituye un elemento esencial que debe ser específicamente analizado y acreditado conforme a la hipótesis acusatoria. en consecuencia, el órgano jurisdiccional debe verificar si los elementos probatorios corresponden con la forma de intervención concretamente imputada; de no hacerlo, se vulneran los principios de congruencia, acusación, presunción de inocencia, imparcialidad judicial y defensa adecuada, reconocidos en los artículos 14, 16, 17, 19 y 21 de la constitución federal, al dictarse una resolución que excede o se aparta del marco fáctico delimitado por la fiscalía. segundo tribunal colegiado en materia penal del segundo circuito.",
  "source_payload_path": "raw/scjn/payloads/tesis/2031962.json",
  "source_pdf_url": null,
  "source_pdf_path": null,
  "source_certificate_sha256": null,
  "parser_version": "scjn-tesis-normalizer-v1",
  "last_seen_at": null,
  "related_documents": [],
  "interpreted_norms": [],
  "status": "vigente_en_fuente",
  "text_checksum_sha256": "08bb3065ca1a6cb7d2af693852994008586f83cc99ea91ba1d27b81049ac2998",
  "metadata_checksum_sha256": "5821cd7d6d686fbb54fc6f41876e39d98b3ad75a47d2d555f6925ad11104464a"
}
