{
  "doc_type": "jurisprudence",
  "document_kind": "tesis",
  "country": "mx",
  "jurisdiction": "federal",
  "court_system": "poder_judicial_federacion",
  "source_system": "scjn_bicentenario_repository",
  "doc_id": "mx-sjf-tesis-2031972",
  "registry_id": "2031972",
  "canonical_url": null,
  "source_url": "https://bicentenario.scjn.gob.mx/repositorio-scjn/api/v1/tesis/2031972",
  "retrieved_at": "2026-03-30T00:55:48.289290Z",
  "title": "MATERIA PROCESAL CIVIL. EL CONGRESO DEL ESTADO DE MORELOS, AL ESTABLECER REQUISITOS PARA LA PROCEDENCIA DEL JUICIO HIPOTECARIO, INVADE LA COMPETENCIA EXCLUSIVA DE LA FEDERACIÓN.",
  "rubro": "MATERIA PROCESAL CIVIL. EL CONGRESO DEL ESTADO DE MORELOS, AL ESTABLECER REQUISITOS PARA LA PROCEDENCIA DEL JUICIO HIPOTECARIO, INVADE LA COMPETENCIA EXCLUSIVA DE LA FEDERACIÓN.",
  "subtitle": null,
  "type": "Jurisprudencia",
  "epoch": "Duodécima Época",
  "instance": "Suprema Corte de Justicia de la Nación",
  "organ": "Pleno",
  "matter": [
    "Común"
  ],
  "case_type": null,
  "case_numbers": [],
  "publication_date": null,
  "binding_note_date": null,
  "mandatory_effect": null,
  "citation_label": "P./J. 46/2026  (12a.) | registro digital 2031972",
  "text": "Hechos: La Comisión Nacional de los Derechos Humanos promovió acción de inconstitucionalidad contra el artículo citado, reformado mediante Decreto número dos mil trescientos ochenta, publicado en el Periódico Oficial “Tierra y Libertad” del Gobierno del Estado de Morelos el 4 de septiembre de 2024. Argumentó que establecer como requisito para la procedencia del juicio hipotecario la presentación del documento original o de la copia certificada de la escritura privada en la cual se hizo constar el otorgamiento de la hipoteca, y acreditar que está inscrita en el Registro Público de la Propiedad, viola los principios de seguridad jurídica y de legalidad. Ello, porque el Congreso local carece de competencia para legislar en materia procesal civil, de conformidad con el artículo 73, fracción XXX, de la Constitución Política de los Estados Unidos Mexicanos. Criterio jurídico: El Congreso del Estado de Morelos al establecer en el artículo 624, fracción III, del Código Procesal Civil para el Estado Libre y Soberano de Morelos, como requisito para la procedencia del juicio hipotecario la presentación del documento original o la copia certificada de la escritura privada en la cual se hizo constar el otorgamiento de la hipoteca, así como acreditar su inscripción en el Registro Público de la Propiedad, emitió una norma materialmente procesal civil y, por tanto, invadió la facultad exclusiva del Congreso de la Unión para legislar en esa materia, establecida en el artículo 73, fracción XXX, de la Constitución Política de los Estados Unidos Mexicanos. Justificación: Con la reforma al referido artículo 73, fracción XXX, publicada en el Diario Oficial de la Federación el 15 de septiembre de 2017, los Congresos locales dejaron de tener competencia para legislar y modificar disposiciones en materia procesal civil y familiar, y se designó al Congreso de la Unión como el órgano competente para expedir la legislación única en esas materias, la cual regirá en toda la República. De las disposiciones transitorias del decreto de reforma constitucional se advierte que: 1) la reforma entró en vigor al día siguiente de su publicación (16 de septiembre de 2017); 2) a partir de ese momento las Legislaturas locales debían adecuar su legislación en un plazo de 180 días posteriores; 3) el Congreso de la Unión debía expedir en ese plazo la legislación única en materia procesal civil y familiar; 4) se precisó que en tanto no entrara en vigor el nuevo código único, continuarían vigentes los de la Federación y de las entidades federativas; y 5) los procedimientos iniciados y las sentencias fundamentadas con estas legislaciones debían concluirse y ejecutarse conforme a las mismas. Con base en lo anterior, el 7 de junio de 2023 se publicó en el Diario Oficial de la Federación el Decreto por el que se expide el Código Nacional de Procedimientos Civiles y Familiares. Ahora bien, el referido Código Nacional regula en sus artículos 506, párrafo segundo y 507, los requisitos para la procedencia del juicio especial hipotecario oral que tiene por objeto el pago o la prelación de un crédito, pero sin precisar las características del documento por el que se otorgue la hipoteca, como lo prevé la norma local reclamada. Aun cuando la norma nacional y la local regulan de manera diferenciada los requisitos para la procedencia del juicio hipotecario, lo cierto es que ambas coinciden en el objeto de regulación que es un proceso de carácter civil, con lo que se demuestra que el artículo 624, fracción III, impugnado, cuya reforma se publicó hasta el 4 de septiembre de 2024 (de forma posterior a la emisión del Código Nacional citado) puede considerarse materialmente como una norma de carácter procesal civil, pues regula un aspecto de esta materia, ya que incide en uno de los requisitos para la promoción y procedencia del juicio hipotecario en el Estado de Morelos que, a su vez, se encuentra prevista en el Código Nacional de Procedimientos Civiles y Familiares. PLENO.",
  "text_normalized": "hechos: la comisión nacional de los derechos humanos promovió acción de inconstitucionalidad contra el artículo citado, reformado mediante decreto número dos mil trescientos ochenta, publicado en el periódico oficial “tierra y libertad” del gobierno del estado de morelos el 4 de septiembre de 2024. argumentó que establecer como requisito para la procedencia del juicio hipotecario la presentación del documento original o de la copia certificada de la escritura privada en la cual se hizo constar el otorgamiento de la hipoteca, y acreditar que está inscrita en el registro público de la propiedad, viola los principios de seguridad jurídica y de legalidad. ello, porque el congreso local carece de competencia para legislar en materia procesal civil, de conformidad con el artículo 73, fracción xxx, de la constitución política de los estados unidos mexicanos. criterio jurídico: el congreso del estado de morelos al establecer en el artículo 624, fracción iii, del código procesal civil para el estado libre y soberano de morelos, como requisito para la procedencia del juicio hipotecario la presentación del documento original o la copia certificada de la escritura privada en la cual se hizo constar el otorgamiento de la hipoteca, así como acreditar su inscripción en el registro público de la propiedad, emitió una norma materialmente procesal civil y, por tanto, invadió la facultad exclusiva del congreso de la unión para legislar en esa materia, establecida en el artículo 73, fracción xxx, de la constitución política de los estados unidos mexicanos. justificación: con la reforma al referido artículo 73, fracción xxx, publicada en el diario oficial de la federación el 15 de septiembre de 2017, los congresos locales dejaron de tener competencia para legislar y modificar disposiciones en materia procesal civil y familiar, y se designó al congreso de la unión como el órgano competente para expedir la legislación única en esas materias, la cual regirá en toda la república. de las disposiciones transitorias del decreto de reforma constitucional se advierte que: 1) la reforma entró en vigor al día siguiente de su publicación (16 de septiembre de 2017); 2) a partir de ese momento las legislaturas locales debían adecuar su legislación en un plazo de 180 días posteriores; 3) el congreso de la unión debía expedir en ese plazo la legislación única en materia procesal civil y familiar; 4) se precisó que en tanto no entrara en vigor el nuevo código único, continuarían vigentes los de la federación y de las entidades federativas; y 5) los procedimientos iniciados y las sentencias fundamentadas con estas legislaciones debían concluirse y ejecutarse conforme a las mismas. con base en lo anterior, el 7 de junio de 2023 se publicó en el diario oficial de la federación el decreto por el que se expide el código nacional de procedimientos civiles y familiares. ahora bien, el referido código nacional regula en sus artículos 506, párrafo segundo y 507, los requisitos para la procedencia del juicio especial hipotecario oral que tiene por objeto el pago o la prelación de un crédito, pero sin precisar las características del documento por el que se otorgue la hipoteca, como lo prevé la norma local reclamada. aun cuando la norma nacional y la local regulan de manera diferenciada los requisitos para la procedencia del juicio hipotecario, lo cierto es que ambas coinciden en el objeto de regulación que es un proceso de carácter civil, con lo que se demuestra que el artículo 624, fracción iii, impugnado, cuya reforma se publicó hasta el 4 de septiembre de 2024 (de forma posterior a la emisión del código nacional citado) puede considerarse materialmente como una norma de carácter procesal civil, pues regula un aspecto de esta materia, ya que incide en uno de los requisitos para la promoción y procedencia del juicio hipotecario en el estado de morelos que, a su vez, se encuentra prevista en el código nacional de procedimientos civiles y familiares. pleno.",
  "source_payload_path": "raw/scjn/payloads/tesis/2031972.json",
  "source_pdf_url": null,
  "source_pdf_path": null,
  "source_certificate_sha256": null,
  "parser_version": "scjn-tesis-normalizer-v1",
  "last_seen_at": null,
  "related_documents": [],
  "interpreted_norms": [],
  "status": "vigente_en_fuente",
  "text_checksum_sha256": "f0a6bd79d692602328a202760efd1a1ab029aca34cdd3b317625aa27a15737dd",
  "metadata_checksum_sha256": "42aab8aff7ca4d4370f92a7ce92a62562ae9f7833adeae1a0f61b0c36e80fb07"
}
